{
  "member": "4a5b6c7d-8e9f-4a0b-9c1d-2e3f4a5b6c7d",
  "device": "c1d2e3f4-a5b6-4c7d-8e9f-0a1b2c3d4e5f",
  "tag": "rec",
  "head": 7,
  "records": [
    {
      "idx": 5,
      "id": "b4c5d6e7-f809-4a1b-9c2d-3e4f5a6b7c8d",
      "epoch": 1,
      "blob": "AQMgPVp3lLHO6wglQl98mbbT8A0qR2SBngkUHyo1QEtWYWx3go2Yo665xM_a5fD7BhEcJzI9SFNeaXR_ipWgq7bBzNfi7fgDDhkkLzpFUFtmcXyHkp2os77J1N_q9QALFiEsN0JNWGNueYSPmqWwu8bR3Ofy_QgTHik0P0pVYGt2gYyXoq24w87Z5O_6BRAbJjE8R1JdaHN-iZSfqrXAy9bh7PcCDRgjLjlET1plcHuGkZynsr3I097p9P8KFSArNkFMV2JteIOOmaSvusXQ2-bx_AcSHSgzPklUX2p1gIuWoay3ws3Y4-75BA8aJTA7RlFcZ3J9iJOeqbS_ytXg6_YBDBciLThDTllkb3qFkJumsbzH0t3o8_4JFB8qNUBLVmFsd4KNmKOu",
      "received_at": 1790906400
    },
    {
      "idx": 6,
      "id": "c5d6e7f8-091a-4b2c-8d3e-4f5a6b7c8d9e",
      "deleted": true
    },
    {
      "idx": 7,
      "id": "d6e7f809-1a2b-4c3d-9e4f-5a6b7c8d9eaf",
      "epoch": 1,
      "blob": "AQQhPlt4lbLP7AkmQ2B9mrfU8Q4rSGWCnwwXIi04Q05ZZG96hZCbprG8x9Ld6PP-CRQfKjVAS1ZhbHeCjZijrrnEz9rl8PsGERwnMj1IU15pdH-KlaCrtsHM1-Lt-AMOGSQvOkVQW2ZxfIeSnaizvsnU3-r1AAsWISw3Qk1YY255hI-apbC7xtHc5_L9CBMeKTQ_SlVga3aBjJeirbjDztnk7_oFEBsmMTxHUl1oc36JlJ-qtcDL1uHs9wINGCMuOURPWmVwe4aRnKeyvcjT3un0_woVICs2QUxXYm14g46ZpK-6xdDb5vH8BxIdKDM-SVRfanWAi5ahrLfCzdjj7vkEDxolMDtGUVxncn2Ik56ptL_K1eDr9gEMFyItOENOWWRveoWQm6axvMfS3ejz_gkUHyo1QEtWYWx3go2Yo665xM_a5fD7BhEcJzI9SFNeaXR_ipWgq7bBzNfi7fgDDhkkLzpFUFtmcXyHkp2os77J1N_q9QALFiEsN0JNWGNueYSPmqWwu8bR3Ofy_QgTHik0P0pVYGt2gYyXoq24w87Z5O_6BRAbJjE8R1JdaHN-iZSfqrXAy9bh7PcCDRgjLjlET1plcHuGkZynsr3I097p9P8KFSArNkFMV2JteIOOmaSvusXQ2-bx_AcSHSgzPklUX2p1gIuWoay3ws3Y4-75BA8aJTA7RlFcZ3J9iJOeqbS_ytXg6_YBDBciLThDTllkb3qFkJumsQ",
      "received_at": 1790910000
    }
  ]
}
